{
  "schemaVersion": 1,
  "lectureId": "021 Tape004-Side1-Ch3.mp3",
  "transcript": "transcripts/021%20Tape004-Side1-Ch3.mp3.json",
  "transcriptSha": "da9a7d2104b4627106a96e9a49167e8ade6191787b85ac05b4da44b49ff58156",
  "method": {
    "name": "mms-fa-ctc-windowed",
    "version": 1,
    "model": "torchaudio.pipelines.MMS_FA (with <star>)",
    "torchaudio": "2.8.0",
    "frameSeconds": 0.02,
    "emissions": {
      "chunkSeconds": 30,
      "contextSeconds": 2
    },
    "transliteration": "ashkenazi-v1",
    "window": {
      "blockWords": 600,
      "commitShare": 0.7,
      "minScore": 0.5,
      "minChars": 4
    },
    "anchor": {
      "minChars": 4,
      "minScore": 0.5,
      "minDurationSeconds": 0.12,
      "maxDurationSeconds": "0.12 * chars + 0.6",
      "maxWordsPerSecond": 7.0
    },
    "softScore": 0.25,
    "interpolation": {
      "gapWeightChars": 2,
      "maxDurationSeconds": 0.5
    }
  },
  "stats": {
    "words": 3994,
    "aligned": 3994,
    "anchors": 806,
    "soft": 1662,
    "interpolated": 1526,
    "anchorPct": 20.2,
    "placedPct": 61.8,
    "anchorGapMedianSeconds": 0.76,
    "anchorGapP90Seconds": 5.38,
    "anchorGapMaxSeconds": 40.2,
    "audioSeconds": 1680.44,
    "soferPileWords": 520,
    "soferNaturalAnchors": 563,
    "soferNaturalMedianAbsDeltaSeconds": 0.71,
    "soferNaturalWithinHalfSecondPct": 19.0
  },
  "words": [
    [0.0,0.5,0.01,0],
    [2.21,2.71,0.0,0],
    [3.93,4.43,0.02,0],
    [4.91,5.41,0.01,0],
    [6.38,6.9,0.25,1],
    [7.18,7.68,0.1,0],
    [7.83,8.33,0.01,0],
    [8.33,8.62,0.03,0],
    [8.62,8.98,0.02,0],
    [8.98,9.48,0.02,0],
    [9.85,10.14,0.05,0],
    [10.14,10.64,0.03,0],
    [10.79,11.15,0.01,0],
    [11.15,11.59,0.0,0],
    [11.59,11.87,0.0,0],
    [11.87,12.31,0.02,0],
    [12.31,12.74,0.06,0],
    [12.74,13.24,0.1,0],
    [13.54,13.83,0.15,0],
    [13.83,14.33,0.09,0],
    [14.55,14.98,0.02,0],
    [14.98,15.2,0.02,0],
    [15.2,15.68,0.71,2],
    [15.63,15.78,0.14,0],
    [15.78,16.1,0.3,1],
    [16.59,17.04,0.12,0],
    [17.04,17.49,0.15,0],
    [17.49,17.94,0.16,0],
    [17.94,18.3,0.01,0],
    [18.3,18.66,0.02,0],
    [18.66,19.16,0.09,0],
    [19.2,19.44,0.34,1],
    [19.58,20.16,0.35,1],
    [20.22,20.8,0.59,2],
    [20.84,21.26,0.3,1],
    [21.28,21.58,0.26,1],
    [21.66,21.68,0.95,1],
    [21.9,22.44,0.73,2],
    [22.52,22.78,0.67,2],
    [22.82,23.22,0.32,1],
    [24.82,25.12,0.85,2],
    [25.3,25.62,0.52,2],
    [25.72,25.92,0.3,1],
    [26.18,26.48,0.31,1],
    [26.58,27.0,0.37,1],
    [27.06,27.48,0.38,1],
    [27.54,27.84,0.51,2],
    [27.92,28.2,0.45,1],
    [28.54,29.04,0.16,0],
    [29.29,29.79,0.05,0],
    [30.53,31.03,0.1,0],
    [31.28,31.78,0.07,0],
    [31.78,32.0,0.5,1],
    [32.18,32.5,0.23,0],
    [32.5,32.98,0.14,0],
    [32.98,33.26,0.26,1],
    [33.34,33.68,0.42,1],
    [33.74,33.9,0.32,1],
    [33.96,34.24,0.41,1],
    [34.3,34.62,0.53,2],
    [34.7,35.1,0.29,1],
    [35.09,35.48,0.24,0],
    [35.48,35.88,0.44,1],
    [35.9,36.0,0.33,1],
    [36.02,36.24,0.14,0],
    [36.24,36.38,0.26,1],
    [36.4,36.48,0.4,1],
    [36.6,36.96,0.86,2],
    [37.0,37.36,0.82,2],
    [38.1,38.22,0.51,1],
    [38.34,38.84,0.41,1],
    [38.9,39.36,0.73,2],
    [39.38,39.74,0.51,2],
    [39.82,39.96,0.5,1],
    [40.08,40.44,0.84,2],
    [40.52,40.8,0.3,1],
    [40.98,41.48,0.22,0],
    [41.52,41.74,0.43,1],
    [41.8,42.16,0.5,1],
    [42.24,42.56,0.44,1],
    [42.94,43.0,0.26,1],
    [43.02,43.36,0.34,1],
    [43.76,44.14,0.64,2],
    [44.66,45.16,0.24,0],
    [45.87,46.37,0.05,0],
    [46.62,47.12,0.17,0],
    [47.82,48.02,0.58,1],
    [48.12,48.38,0.71,1],
    [48.42,48.68,0.54,2],
    [48.72,49.14,0.61,2],
    [50.24,50.64,0.66,2],
    [50.74,51.1,0.19,0],
    [51.1,51.44,0.64,2],
    [52.12,52.36,0.4,1],
    [52.42,52.66,0.38,1],
    [52.72,53.02,0.12,0],
    [53.02,53.3,0.49,1],
    [53.38,53.78,0.28,1],
    [54.38,54.88,0.09,0],
    [55.16,55.61,0.0,0],
    [55.61,56.11,0.06,0],
    [56.27,56.77,0.07,0],
    [56.83,57.33,0.04,0],
    [57.39,57.89,0.05,0],
    [58.06,58.56,0.16,0],
    [58.61,59.11,0.22,0],
    [59.17,59.67,0.19,0],
    [59.95,60.39,0.24,0],
    [60.39,60.89,0.17,0],
    [61.06,61.56,0.15,0],
    [61.73,62.23,0.14,0],
    [62.29,62.79,0.01,0],
    [62.84,63.34,0.18,0],
    [63.4,63.84,0.17,0],
    [63.84,64.29,0.12,0],
    [64.29,64.79,0.22,0],
    [64.96,65.46,0.05,0],
    [65.62,66.07,0.08,0],
    [66.07,66.57,0.17,0],
    [66.63,67.07,0.12,0],
    [67.07,67.57,0.16,0],
    [67.74,67.82,0.47,1],
    [67.97,68.21,0.16,0],
    [68.21,68.44,0.01,0],
    [68.44,68.58,0.42,1],
    [68.7,69.02,0.39,1],
    [69.13,69.63,0.19,0],
    [69.64,69.99,0.16,0],
    [69.99,70.49,0.21,0],
    [70.5,70.74,0.58,1],
    [71.71,72.21,0.21,0],
    [73.16,73.4,0.47,1],
    [73.76,74.26,0.14,0],
    [74.27,74.7,0.15,0],
    [74.7,75.2,0.22,0],
    [75.21,75.55,0.03,0],
    [75.55,76.05,0.08,0],
    [76.15,76.65,0.14,0],
    [76.83,77.33,0.2,0],
    [77.34,77.42,0.37,1],
    [77.44,77.64,0.28,1],
    [77.67,77.91,0.2,0],
    [77.91,78.1,0.14,0],
    [78.1,78.12,0.37,1],
    [78.18,78.44,0.29,1],
    [78.46,78.69,0.21,0],
    [78.69,78.92,0.24,0],
    [78.92,79.2,0.08,0],
    [79.2,79.43,0.02,0],
    [79.43,79.66,0.03,0],
    [79.66,79.89,0.02,0],
    [79.89,80.17,0.0,0],
    [80.17,80.4,0.21,0],
    [80.4,80.63,0.01,0],
    [80.63,80.86,0.07,0],
    [80.86,81.02,0.42,1],
    [81.08,81.18,0.32,1],
    [81.27,81.49,0.21,0],
    [81.49,81.64,0.19,0],
    [81.64,81.7,0.26,1],
    [81.74,81.96,0.31,1],
    [82.29,82.75,0.17,0],
    [82.75,83.25,0.24,0],
    [83.3,83.8,0.02,0],
    [83.85,84.35,0.06,0],
    [84.63,84.94,0.01,0],
    [84.94,85.14,0.36,1],
    [85.18,85.3,0.27,1],
    [85.36,85.76,0.3,1],
    [87.18,87.68,0.15,0],
    [88.74,89.24,0.04,0],
    [90.04,90.24,0.27,1],
    [90.26,90.46,0.26,1],
    [90.56,90.8,0.55,1],
    [90.86,91.24,0.33,1],
    [91.3,91.76,0.5,2],
    [91.7,92.2,0.2,0],
    [92.44,92.92,0.38,1],
    [92.98,93.58,0.28,1],
    [93.62,93.88,0.36,1],
    [95.2,95.34,0.34,1],
    [95.53,96.03,0.23,0],
    [96.26,96.5,0.27,1],
    [96.66,97.06,0.22,0],
    [97.06,97.24,0.35,1],
    [97.28,97.46,0.28,1],
    [97.54,98.14,0.37,1],
    [98.24,98.56,0.25,1],
    [99.02,99.52,0.08,0],
    [99.68,99.86,0.29,1],
    [99.94,100.34,0.35,1],
    [100.22,100.6,0.24,0],
    [100.6,100.84,0.24,0],
    [100.84,100.98,0.3,1],
    [101.0,101.1,0.01,0],
    [101.1,101.38,0.61,1],
    [101.44,101.58,0.59,1],
    [101.62,101.88,0.28,1],
    [102.85,103.35,0.01,0],
    [104.07,104.57,0.0,0],
    [104.95,105.45,0.01,0],
    [106.0,106.5,0.01,0],
    [107.4,107.9,0.01,0],
    [108.8,109.3,0.03,0],
    [109.68,110.34,0.26,1],
    [110.21,110.48,0.04,0],
    [110.48,110.74,0.28,1],
    [110.86,111.16,0.53,1],
    [111.26,111.54,0.4,1],
    [111.58,112.0,0.46,1],
    [112.33,112.83,0.02,0],
    [112.83,113.33,0.23,0],
    [113.5,113.92,0.07,0],
    [113.92,114.02,0.31,1],
    [114.1,114.36,0.36,1],
    [114.4,114.64,0.44,1],
    [114.9,115.02,0.43,1],
    [115.06,115.22,0.68,2],
    [115.24,115.42,0.53,2],
    [115.5,115.78,0.68,2],
    [115.96,116.1,0.44,1],
    [116.14,116.22,0.57,1],
    [116.31,116.56,0.24,0],
    [116.56,116.82,0.45,1],
    [116.88,117.09,0.18,0],
    [117.09,117.36,0.2,0],
    [117.36,117.46,0.26,1],
    [117.57,117.78,0.13,0],
    [117.78,118.12,0.51,2],
    [118.4,118.68,0.73,2],
    [118.7,118.76,0.27,1],
    [118.92,119.21,0.2,0],
    [119.21,119.49,0.07,0],
    [119.49,119.99,0.09,0],
    [120.16,120.61,0.08,0],
    [120.61,120.84,0.15,0],
    [120.84,121.29,0.23,0],
    [121.29,121.68,0.2,0],
    [121.68,122.02,0.26,1],
    [122.36,122.86,0.08,0],
    [122.92,123.38,0.18,0],
    [123.38,123.88,0.22,0],
    [124.28,124.8,0.41,1],
    [124.86,125.26,0.38,1],
    [125.52,126.02,0.14,0],
    [126.18,126.6,0.0,0],
    [126.6,127.01,0.0,0],
    [127.01,127.43,0.15,0],
    [127.43,127.84,0.11,0],
    [127.84,128.4,0.3,1],
    [128.5,128.7,0.04,0],
    [128.7,129.2,0.16,0],
    [129.31,129.76,0.03,0],
    [129.76,130.06,0.0,0],
    [130.06,130.47,0.05,0],
    [130.47,130.77,0.1,0],
    [130.77,131.23,0.0,0],
    [131.23,131.73,0.0,0],
    [131.78,132.24,0.0,0],
    [132.24,132.54,0.0,0],
    [132.54,133.04,0.0,0],
    [133.1,133.4,0.0,0],
    [133.4,133.71,0.0,0],
    [133.71,134.16,0.0,0],
    [134.16,134.46,0.0,0],
    [134.46,134.77,0.0,0],
    [134.77,135.27,0.01,0],
    [135.32,135.63,0.0,0],
    [135.63,136.03,0.02,0],
    [136.03,136.33,0.08,0],
    [136.33,136.83,0.12,0],
    [137.19,137.55,0.06,0],
    [137.55,137.9,0.07,0],
    [137.9,138.2,0.2,0],
    [138.2,138.46,0.09,0],
    [138.46,138.66,0.22,0],
    [138.66,139.02,0.27,1],
    [139.1,139.6,0.17,0],
    [139.6,140.04,0.16,0],
    [140.04,140.58,0.38,1],
    [140.84,141.02,0.49,1],
    [141.04,141.26,0.29,1],
    [141.28,141.64,0.34,1],
    [141.66,141.98,0.2,0],
    [141.98,142.42,0.27,1],
    [142.7,143.18,0.34,1],
    [143.26,143.42,0.43,1],
    [143.72,144.18,0.42,1],
    [144.64,145.1,0.54,2],
    [146.02,146.18,0.91,1],
    [146.3,146.57,0.03,0],
    [146.57,147.07,0.04,0],
    [147.12,147.4,0.34,1],
    [147.58,147.84,0.61,1],
    [148.0,148.38,0.6,2],
    [148.35,148.6,0.16,0],
    [148.6,148.86,0.31,1],
    [148.92,148.96,0.45,1],
    [149.08,149.36,0.89,2],
    [149.38,149.44,0.41,1],
    [149.5,149.82,0.55,2],
    [149.86,150.04,0.64,2],
    [150.1,150.38,0.54,2],
    [150.85,151.28,0.07,0],
    [151.28,151.78,0.24,0],
    [152.24,152.74,0.24,0],
    [153.1,153.58,0.25,1],
    [153.92,154.0,0.42,1],
    [154.05,154.27,0.1,0],
    [154.27,154.5,0.12,0],
    [154.5,154.66,0.03,0],
    [154.66,154.91,0.23,0],
    [154.91,155.04,0.18,0],
    [155.04,155.06,0.4,1],
    [155.13,155.34,0.25,0],
    [155.34,155.68,0.25,1],
    [155.8,155.98,0.52,1],
    [156.0,156.42,0.39,1],
    [156.5,156.92,0.5,1],
    [156.98,157.4,0.53,2],
    [157.42,157.76,0.52,2],
    [158.76,159.26,0.22,0],
    [159.77,160.27,0.04,0],
    [160.78,161.2,0.45,1],
    [161.45,161.82,0.22,0],
    [161.82,161.96,0.35,1],
    [162.0,162.2,0.35,1],